{
  "protocol": "vllm_api_key_v1",
  "target": {
    "host_node_id": "node-local-1",
    "gateway_id": "gateway-1",
    "pool_id": "asr-batch",
    "instance_id": "instance-asr-1",
    "instance_generation": 1,
    "binding_revision_id": "binding-revision-compose-example"
  },
  "address": "10.0.0.10",
  "port": 18100,
  "served_model": "asr-compose-example",
  "bearer_token": "0000000000000000000000000000000000000000000000000000000000000000"
}
